{
  "actions": [
    {
      "actionType": "connector",
      "description": "Specify an amount of time and its unit to periodically trigger integration execution. ",
      "descriptor": {
        "componentScheme": "timer",
        "configuredProperties": {
          "timerName": "syndesis-timer"
        },
        "inputDataShape": {
          "kind": "none"
        },
        "outputDataShape": {
          "kind": "none"
        },
        "propertyDefinitionSteps": [
          {
            "description": "Period",
            "name": "Period",
            "properties": {
              "period": {
                "componentProperty": false,
                "defaultValue": 60000,
                "deprecated": false,
                "description": "Period",
                "displayName": "Period",
                "javaType": "long",
                "kind": "parameter",
                "labelHint": "Delay between each execution of the integration.",
                "required": true,
                "secret": false,
                "type": "duration"
              }
            }
          }
        ]
      },
      "id": "io.syndesis:timer-action",
      "name": "Simple",
      "pattern": "From"
    },
    {
      "actionType": "connector",
      "description": "Specify a cron utility expression for a more complex integration execution schedule.",
      "descriptor": {
        "componentScheme": "quartz",
        "configuredProperties": {
          "triggerName": "syndesis-quartz"
        },
        "inputDataShape": {
          "kind": "none"
        },
        "outputDataShape": {
          "kind": "none"
        },
        "propertyDefinitionSteps": [
          {
            "description": "Cron",
            "name": "cron",
            "properties": {
              "cron": {
                "componentProperty": false,
                "defaultValue": "0 0/1 * * * ?",
                "deprecated": false,
                "description": "A cron expression, for example the expression for every minute is 0 0/1 * * * ?",
                "displayName": "Cron Expression",
                "javaType": "string",
                "kind": "parameter",
                "labelHint": "Delay between scheduling (executing) the integration expressed as a cron expression",
                "required": true,
                "secret": false,
                "type": "string"
              }
            }
          }
        ]
      },
      "id": "io.syndesis:timer-chron",
      "name": "Cron",
      "pattern": "From"
    }
  ],
  "configuredProperties": {},
  "dependencies": [
    {
      "id": "@project.groupId@:@project.artifactId@:@project.version@",
      "type": "MAVEN"
    },
    {
      "id": "org.apache.camel:camel-quartz:@camel.version@",
      "type": "MAVEN"
    }
  ],
  "description": "Trigger events based on an interval or a quartz expression",
  "icon": "assets:timer.svg",
  "id": "timer",
  "metadata": {
    "hide-from-connection-pages": true
  },
  "name": "Timer"
}
