{
  "actions": [
    {
      "actionType": "connector",
      "description": "Publish data to the Kafka topic that you select.",
      "descriptor": {
        "configuredProperties": {},
        "inputDataShape": {
          "kind": "any"
        },
        "outputDataShape": {
          "kind": "none"
        },
        "propertyDefinitionSteps": [
          {
            "description": "Specify Kafka topic name",
            "name": "Select the Kafka topic",
            "properties": {
              "topic": {
                "componentProperty": false,
                "deprecated": false,
                "displayName": "Topic Name",
                "group": "common",
                "javaType": "java.lang.String",
                "kind": "path",
                "labelHint": "Select the Kafka topic to send data to.",
                "order": "1",
                "required": true,
                "secret": false,
                "tags": [],
                "type": "string"
              }
            }
          }
        ]
      },
      "id": "io.syndesis:kafka-publish-action",
      "name": "Publish",
      "pattern": "To",
      "tags": [
        "dynamic"
      ]
    },
    {
      "actionType": "connector",
      "description": "Receive data from the Kafka topic that you select.",
      "descriptor": {
        "configuredProperties": {},
        "inputDataShape": {
          "kind": "none"
        },
        "outputDataShape": {
          "kind": "any"
        },
        "propertyDefinitionSteps": [
          {
            "description": "Select the Kafka topic name",
            "name": "Select the Kafka topic",
            "properties": {
              "topic": {
                "componentProperty": false,
                "deprecated": false,
                "displayName": "Topic Name",
                "group": "common",
                "javaType": "java.lang.String",
                "kind": "path",
                "labelHint": "Select the Kafka topic to receive data from.",
                "order": "1",
                "required": true,
                "secret": false,
                "tags": [],
                "type": "string"
              }
            }
          }
        ]
      },
      "id": "io.syndesis:kafka-subscribe-action",
      "name": "Subscribe",
      "pattern": "From",
      "tags": [
        "dynamic"
      ]
    }
  ],
  "componentScheme": "kafka",
  "configuredProperties": {},
  "dependencies": [
    {
      "id": "@project.groupId@:@project.artifactId@:@project.version@",
      "type": "MAVEN"
    }
  ],
  "description": "Subscribe for and publish messages",
  "icon": "assets:kafka.svg",
  "id": "kafka",
  "name": "Kafka Message Broker",
  "properties": {
    "brokers": {
      "componentProperty": true,
      "deprecated": false,
      "displayName": "Kafka Broker URIs",
      "group": "common",
      "javaType": "java.lang.String",
      "kind": "property",
      "label": "common",
      "labelHint": "Comma separated list of Kafka broker URIs in the form host:port. Note that SSL URIs are not supported at this time and will cause an OOM at connection verification (see also https://issues.apache.org/jira/browse/KAFKA-4090)",
      "order": "1",
      "required": true,
      "secret": false,
      "type": "typeahead"
    }
  },
  "tags": [
    "verifier",
    "dynamic"
  ]
}
